id,protein_name,gene_names,organism_name,accessions,proteome,function
A0A0C5B5G6,Mitochondrial-derived peptide MOTS-c,MT-RNR1,Homo sapiens,,UP000005640,"Regulates insulin sensitivity and metabolic homeostasis (PubMed:25738459, PubMed:33468709). Inhibits the folate cycle, thereby reducing de novo purine biosynthesis which leads to the accumulation of the de novo purine synthesis intermediate 5-aminoimidazole-4-carboxamide (AICAR) and the activation of the metabolic regulator 5'-AMP-activated protein kinase (AMPK) (PubMed:25738459). Protects against age-dependent and diet-induced insulin resistance as well as diet-induced obesity (PubMed:25738459). In response to metabolic stress, translocates to the nucleus where it binds to antioxidant response elements (ARE) present in the promoter regions of a number of genes and plays a role in regulating nuclear gene expression in an NFE2L2-dependent manner and increasing cellular resistance to metabolic stress (PubMed:29983246). Increases mitochondrial respiration and levels of CPT1A and cytokines IL1B, IL6, IL8, IL10 and TNF in senescent cells (PubMed:29886458). Increases activity of the serine/threonine protein kinase complex mTORC2 and reduces activity of the PTEN phosphatase, thus promoting phosphorylation of AKT (PubMed:33554779). This promotes AKT-mediated phosphorylation of transcription factor FOXO1 which reduces FOXO1 activity, leading to reduced levels of MSTN and promotion of skeletal muscle growth (PubMed:33554779). Promotes osteogenic differentiation of bone marrow mesenchymal stem cells via the TGFB/SMAD pathway (PubMed:30468456). Promotes osteoblast proliferation and osteoblast synthesis of type I collagens COL1A1 and COL1A2 via the TGFB/SMAD pathway (PubMed:31081069)"
A0A1B0GTW7,Ciliated left-right organizer metallopeptidase,CIROP,Homo sapiens,A0A2R8Y3T5,UP000005640,Putative metalloproteinase that plays a role in left-right patterning process
A0JNW5,Bridge-like lipid transfer protein family member 3B,BLTP3B,Homo sapiens,"A0PJE5, O75183, Q8NDL1, Q96C30, Q9BTS5, Q9H0F1",UP000005640,"Tube-forming lipid transport protein which mediates the transfer of lipids between membranes at organelle contact sites (PubMed:35499567). Required for retrograde traffic of vesicle clusters in the early endocytic pathway to the Golgi complex (PubMed:20163565, PubMed:35499567)"
A0JP26,POTE ankyrin domain family member B3,POTEB3,Homo sapiens,"A0A096LPD0, Q6NXN7, Q6S5H4, Q6S5H7",UP000005640,
A0PK11,Clarin-2,CLRN2,Homo sapiens,,UP000005640,Plays a key role to hearing function. Required for normal organization and maintenance of the stereocilia bundle and for mechano-electrical transduction
A1A4S6,Rho GTPase-activating protein 10,ARHGAP10,Homo sapiens,"A1L0S5, Q2VPC4, Q2VPC5, Q96EV3, Q96S75",UP000005640,"GTPase-activating protein that catalyzes the conversion of active GTP-bound Rho GTPases to their inactive GDP-bound form, thus suppressing various Rho GTPase-mediated cellular processes (PubMed:11432776). Also converts Cdc42 to an inactive GDP-bound state (PubMed:11432776). Essential for PTKB2 regulation of cytoskeletal organization via Rho family GTPases. Inhibits PAK2 proteolytic fragment PAK-2p34 kinase activity and changes its localization from the nucleus to the perinuclear region. Stabilizes PAK-2p34 thereby increasing stimulation of cell death (By similarity). Associates with MICAL1 on the endosomal membrane to promote Rab8-Rab10-dependent tubule extension. After dissociation with MICAL1, recruits WDR44 which connects the endoplasmic reticulum (ER) with the endosomal tubule, thereby participating in the export of a subset of neosynthesized proteins (PubMed:32344433)"
A1A519,Protein FAM170A,FAM170A,Homo sapiens,"Q66LM8, Q7Z4V2, Q8IW94",UP000005640,Acts as a nuclear transcription factor that positively regulates the expression of heat shock genes. Binds to heat shock promoter elements (HSE)
A1L190,Synaptonemal complex central element protein 3,SYCE3,Homo sapiens,,UP000005640,"Major component of the transverse central element of synaptonemal complexes (SCS), formed between homologous chromosomes during meiotic prophase. Required for chromosome loading of the central element-specific SCS proteins, and for initiating synapsis between homologous chromosomes. Chromosome loading appears to require SYCP1. Required for fertility"
A1L3X0,Very long chain fatty acid elongase 7,ELOVL7,Homo sapiens,"Q589T3, Q9H5D0, Q9NT66",UP000005640,"Catalyzes the first and rate-limiting reaction of the four reactions that constitute the long-chain fatty acids elongation cycle. This endoplasmic reticulum-bound enzymatic process allows the addition of 2 carbons to the chain of long- and very long-chain fatty acids (VLCFAs) per cycle. Condensing enzyme with higher activity toward C18 acyl-CoAs, especially C18:3(n-3) acyl-CoAs and C18:3(n-6)-CoAs. Also active toward C20:4-, C18:0-, C18:1-, C18:2- and C16:0-CoAs, and weakly toward C20:0-CoA. Little or no activity toward C22:0-, C24:0-, or C26:0-CoAs. May participate in the production of saturated and polyunsaturated VLCFAs of different chain lengths that are involved in multiple biological processes as precursors of membrane lipids and lipid mediators"
A1X283,SH3 and PX domain-containing protein 2B,SH3PXD2B,Homo sapiens,"B6F0V2, Q9P2Q1",UP000005640,"Adapter protein involved in invadopodia and podosome formation and extracellular matrix degradation. Binds matrix metalloproteinases (ADAMs), NADPH oxidases (NOXs) and phosphoinositides. Acts as an organizer protein that allows NOX1- or NOX3-dependent reactive oxygen species (ROS) generation and ROS localization. Plays a role in mitotic clonal expansion during the immediate early stage of adipocyte differentiation (By similarity)"
A2A2Y4,FERM domain-containing protein 3,FRMD3,Homo sapiens,"A8MQB0, B4DN14, Q53EP2, Q5JV59, Q5VZA1, Q86WP8, Q8IZ44, Q8N3Y5, Q8N9L2",UP000005640,Putative tumor suppressor gene that may be implicated in the origin and progression of lung cancer
A2RU14,Transmembrane protein 218,TMEM218,Homo sapiens,B7ZM48,UP000005640,May be involved in ciliary biogenesis or function
A2RUB6,Coiled-coil domain-containing protein 66,CCDC66,Homo sapiens,"B3KWL8, Q4VC34, Q8N949",UP000005640,"Microtubule-binding protein required for ciliogenesis (PubMed:28235840). May function in ciliogenesis by mediating the transport of proteins like BBS4 to the cilium, but also through the organization of the centriolar satellites (PubMed:28235840). Plays a role in retina morphogenesis and/or homeostasis (By similarity)"
A2RUC4,tRNA wybutosine-synthesizing protein 5,TYW5,Homo sapiens,"B2RNE3, Q8N1R2",UP000005640,tRNA hydroxylase that acts as a component of the wybutosine biosynthesis pathway. Wybutosine is a hyper modified guanosine with a tricyclic base found at the 3'-position adjacent to the anticodon of eukaryotic phenylalanine tRNA. Catalyzes the hydroxylation of 7-(a-amino-a-carboxypropyl)wyosine (yW-72) into undermodified hydroxywybutosine (OHyW*). OHyW* being further transformed into hydroxywybutosine (OHyW) by LCMT2/TYW4. OHyW is a derivative of wybutosine found in higher eukaryotes
A4D1B5,Gamma-secretase-activating protein,GSAP,Homo sapiens,"A4D1B6, Q3MJC0, Q8ND73, Q9UMH3, Q9Y4L9",UP000005640,"Regulator of gamma-secretase activity, which specifically activates the production of amyloid-beta protein (amyloid-beta protein 40 and amyloid-beta protein 42), without affecting the cleavage of other gamma-secretase targets such has Notch. The gamma-secretase complex is an endoprotease complex that catalyzes the intramembrane cleavage of integral membrane proteins such as Notch receptors and APP (amyloid-beta precursor protein). Specifically promotes the gamma-cleavage of APP CTF-alpha (also named APP-CTF) by the gamma-secretase complex to generate amyloid-beta, while it reduces the epsilon-cleavage of APP CTF-alpha, leading to a low production of AICD"
A4GXA9,Probable crossover junction endonuclease EME2,EME2,Homo sapiens,"Q8TEP2, Q96RY3",UP000005640,Interacts with MUS81 to form a DNA structure-specific endonuclease which cleaves substrates such as 3'-flap structures
A5D8V7,Outer dynein arm-docking complex subunit 3,ODAD3,Homo sapiens,"B4DXT0, Q96CG5",UP000005640,Component of the outer dynein arm-docking complex (ODA-DC) that mediates outer dynein arms (ODA) binding onto the doublet microtubule (PubMed:25192045). Involved in mediating assembly of both ODAs and their axonemal docking complex onto ciliary microtubules (PubMed:25192045)
A5PLL7,Plasmanylethanolamine desaturase 1,PEDS1,Homo sapiens,,UP000005640,"Plasmanylethanolamine desaturase involved in plasmalogen biogenesis in the endoplasmic reticulum membrane (PubMed:31604315, PubMed:32209662, PubMed:33859415). Plasmalogens are glycerophospholipids with a hydrocarbon chain linked by a vinyl ether bond at the glycerol sn-1 position, and are involved in antioxidative and signaling mechanisms (PubMed:31604315)"
A6BM72,Multiple epidermal growth factor-like domains protein 11,MEGF11,Homo sapiens,"Q17R86, Q6UXS5, Q8ND91, Q96KG6",UP000005640,"May regulate the mosaic spacing of specific neuron subtypes in the retina through homotypic retinal neuron repulsion. Mosaics provide a mechanism to distribute each cell type evenly across the retina, ensuring that all parts of the visual field have access to a full set of processing elements (By similarity)"
A6H8Y1,Transcription factor TFIIIB component B'' homolog,BDP1,Homo sapiens,"Q68DS6, Q68DY5, Q6MZL9, Q6PIM7, Q86W98, Q96LR8, Q9C0H4, Q9H197, Q9H1A1, Q9HAW1, Q9HAW2, Q9HCY0, Q9ULH9",UP000005640,General activator of RNA polymerase III transcription. Requires for transcription from all three types of polymerase III promoters. Requires for transcription of genes with internal promoter elements and with promoter elements upstream of the initiation site
A6NCS4,Homeobox protein Nkx-2.6,NKX2-6,Homo sapiens,,UP000005640,"Acts as a transcriptional activator (PubMed:15649947). In conjunction with NKX2-5, may play a role in both pharyngeal and cardiac embryonic development"
A6NFY7,"Succinate dehydrogenase assembly factor 1, mitochondrial",SDHAF1,Homo sapiens,B2RPM7,UP000005640,"Plays an essential role in the assembly of succinate dehydrogenase (SDH), an enzyme complex (also referred to as respiratory complex II) that is a component of both the tricarboxylic acid (TCA) cycle and the mitochondrial electron transport chain, and which couples the oxidation of succinate to fumarate with the reduction of ubiquinone (coenzyme Q) to ubiquinol (PubMed:19465911, PubMed:24954417). Promotes maturation of the iron-sulfur protein subunit SDHB of the SDH catalytic dimer, protecting it from the deleterious effects of oxidants (PubMed:24954417). May act together with SDHAF3 (PubMed:24954417). Contributes to iron-sulfur cluster incorporation into SDHB by binding to SDHB and recruiting the iron-sulfur transfer complex formed by HSC20, HSPA9 and ISCU through direct binding to HSC20 (PubMed:26749241)"
A6NGG8,Photoreceptor cilium actin regulator,PCARE,Homo sapiens,,UP000005640,Plays an essential role for normal photoreceptor cell maintenance and vision
A6NI61,Protein myomaker,MYMK,Homo sapiens,,UP000005640,"Myoblast-specific protein that mediates myoblast fusion, an essential step for the formation of multi-nucleated muscle fibers (PubMed:28681861). Actively participates in the membrane fusion reaction by mediating the mixing of cell membrane lipids (hemifusion) upstream of MYMX. Acts independently of MYMX (By similarity). Involved in skeletal muscle regeneration in response to injury by mediating the fusion of satellite cells, a population of muscle stem cells, with injured myofibers (By similarity). Also involved in skeletal muscle hypertrophy, probably by mediating the fusion of satellite cells with myofibers (By similarity)"
A6NKB5,Pecanex-like protein 2,PCNX2,Homo sapiens,"O43162, Q5T9Z8, Q5TDF1, Q8TEP4, Q96HP9, Q9HAL8",UP000005640,May play a role in tumorigenesis of colorectal carcinomas with high microsatellite instability (MSI-H)
A6NNB3,Interferon-induced transmembrane protein 5,IFITM5,Homo sapiens,,UP000005640,Required for normal bone mineralization
A7E2V4,Zinc finger SWIM domain-containing protein 8,ZSWIM8,Homo sapiens,"B2RP37, O94987, Q17RS8, Q2TAB8, Q6P439, Q8IW81, Q8NB34, Q9H8F3",UP000005640,"Substrate recognition component of a SCF-like E3 ubiquitin-protein ligase complex that promotes target-directed microRNA degradation (TDMD), a process that mediates degradation of microRNAs (miRNAs) (PubMed:33184234, PubMed:33184237). The SCF-like E3 ubiquitin-protein ligase complex acts by catalyzing ubiquitination and subsequent degradation of AGO proteins (AGO1, AGO2, AGO3 and/or AGO4), thereby exposing miRNAs for degradation (PubMed:33184234, PubMed:33184237). Specifically recognizes and binds AGO proteins when they are engaged with a TDMD target (PubMed:33184234). May also act as a regulator of axon guidance: specifically recognizes misfolded ROBO3 and promotes its ubiquitination and subsequent degradation (PubMed:24012004)"
A7MCY6,TANK-binding kinase 1-binding protein 1,TBKBP1,Homo sapiens,"B2RZG6, O94873, Q14DW3",UP000005640,Adapter protein which constitutively binds TBK1 and IKBKE playing a role in antiviral innate immunity
A7MD48,Serine/arginine repetitive matrix protein 4,SRRM4,Homo sapiens,"A8K5P6, B2RZH7, Q7Z5F0, Q96JH4",UP000005640,"Splicing factor specifically required for neural cell differentiation. Acts in conjunction with nPTB/PTBP2 by binding directly to its regulated target transcripts and promotes neural-specific exon inclusion in many genes that function in neural cell differentiation. Required to promote the inclusion of neural-specific exon 10 in nPTB/PTBP2, leading to increased expression of neural-specific nPTB/PTBP2. Also promotes the inclusion of exon 16 in DAAM1 in neuron extracts (By similarity). Promotes alternative splicing of REST transcripts to produce REST isoform 3 (REST4) with greatly reduced repressive activity, thereby activating expression of REST targets in neural cells (PubMed:30684677). Plays an important role during embryonic development as well as in the proper functioning of the adult nervous system. Regulates alternative splicing events in genes with important neuronal functions (By similarity)"
A7XYQ1,Sine oculis-binding protein homolog,SOBP,Homo sapiens,"B0QZ12, Q5BJD4, Q8N2B2",UP000005640,Implicated in development of the cochlea
A8MQ03,Cysteine-rich tail protein 1,CYSRT1,Homo sapiens,Q86UY7,UP000005640,Component of the stratum corneum that may contribute to epidermal antimicrobial host defenses
A8MW99,Meiosis-specific protein MEI4,MEI4,Homo sapiens,R4GMV8,UP000005640,"Required for DNA double-strand breaks (DSBs) formation in unsynapsed regions during meiotic recombination. Probably acts by forming a complex with IHO1 and REC114, which activates DSBs formation in unsynapsed regions, an essential step to ensure completion of synapsis"
A9UHW6,MIF4G domain-containing protein,MIF4GD,Homo sapiens,"B4DUM7, Q8N4Q5, Q9HBL5",UP000005640,Functions in replication-dependent translation of histone mRNAs which differ from other eukaryotic mRNAs in that they do not end with a poly-A tail but a stem-loop. May participate in circularizing those mRNAs specifically enhancing their translation
B1AK53,Espin,ESPN,Homo sapiens,"Q6XYB2, Q9H0A2, Q9Y329",UP000005640,"Multifunctional actin-bundling protein. Plays a major role in regulating the organization, dimension, dynamics and signaling capacities of the actin filament-rich microvilli in the mechanosensory and chemosensory cells (PubMed:29572253). Required for the assembly and stabilization of the stereociliary parallel actin bundles. Plays a crucial role in the formation and maintenance of inner ear hair cell stereocilia (By similarity). Involved in the elongation of actin in stereocilia (PubMed:29572253). In extrastriolar hair cells, required for targeting MYO3B to stereocilia tips, and for regulation of stereocilia diameter and staircase formation"
B2RUY7,von Willebrand factor C domain-containing protein 2-like,VWC2L,Homo sapiens,"A6NC69, B2RUW7, B7X8X1",UP000005640,May play a role in neurogenesis. May play a role in bone differentiation and matrix mineralization
B3KU38,IQCJ-SCHIP1 readthrough transcript protein,IQCJ-SCHIP1,Homo sapiens,"B3KRM0, O75543, Q00P30, Q00P31, Q7Z3Y3, Q8IY83, Q9P0W3, Q9P0W4, Q9P0W5",UP000005640,May play a role in action potential conduction in myelinated cells through the organization of molecular complexes at nodes of Ranvier and axon initial segments (PubMed:25950943). May also play a role in axon outgrowth and guidance (By similarity)
B6A8C7,"T-cell-interacting, activating receptor on myeloid cells protein 1",TARM1,Homo sapiens,B4DWY4,UP000005640,"May act as receptor (By similarity). Negatively regulates TCR-mediated CD4(+) T cell proliferation and activation, possibly by binding an unknown ligand on the T cell surface (PubMed:26311901). Enhances Toll-like receptor-mediated production of pro-inflammatory cytokines by macrophages and neutrophils (By similarity)"
B7U540,Inward rectifier potassium channel 18,KCNJ18,Homo sapiens,"A0A075B742, A0A142CKZ1, A0A142CKZ2",UP000005640,"Inward rectifier potassium channels are characterized by a greater tendency to allow potassium to flow into the cell rather than out of it. Their voltage dependence is regulated by the concentration of extracellular potassium; as external potassium is raised, the voltage range of the channel opening shifts to more positive voltages. The inward rectification is mainly due to the blockage of outward current by internal magnesium"
C9JLW8,Mapk-regulated corepressor-interacting protein 1,MCRIP1,Homo sapiens,Q6ZUL0,UP000005640,"The phosphorylation status of MCRIP1 functions as a molecular switch to regulate epithelial-mesenchymal transition. Unphosphorylated MCRIP1 binds to and inhibits the transcriptional corepressor CTBP(s). When phosphorylated by MAPK/ERK, MCRIP1 releases CTBP(s) resulting in transcriptional silencing of the E-cadherin gene and induction of epithelial-mesenchymal transition (PubMed:25728771)"
C9JRZ8,Aldo-keto reductase family 1 member B15,AKR1B15,Homo sapiens,C9J3V2,UP000005640,"Catalyzes the NADPH-dependent reduction of a variety of carbonyl substrates, like aromatic aldehydes, alkenals, ketones and alpha-dicarbonyl compounds (PubMed:21276782, PubMed:26222439). In addition, catalyzes the reduction of androgens and estrogens with high positional selectivity (shows 17-beta-hydroxysteroid dehydrogenase activity) as well as 3-keto-acyl-CoAs (PubMed:25577493). Displays strong enzymatic activity toward all-trans-retinal and 9-cis-retinal (PubMed:26222439). May play a physiological role in retinoid metabolism (PubMed:26222439)"
D3W0D1,Killer cell lectin-like receptor subfamily F member 2,KLRF2,Homo sapiens,,UP000005640,"C-type lectin-like receptor involved in natural killer cell mediated cytotoxicity and cytokine secretion in keratinocytes via its interaction with CLEC2A (PubMed:20194751, PubMed:25510854). Triggers degranulation in a SYK-dependent manner and stimulates SYK phosphotyrosinylation without recruiting SYK directly (PubMed:28082678)"
E0CX11,Short transmembrane mitochondrial protein 1,STMP1,Homo sapiens,,UP000005640,Microprotein involved in mitochondrial respiratory chain complex III (ubiquinol-cytochrome c oxidoreductase) and complex IV (mitochondrial cytochrome c oxidase complex) assembly (PubMed:35450818). Required for the formation of mitochondrial supercomplexes (SCs) (PubMed:35450818). Also required for the activation of the NLRP3 inflammasome (By similarity)
O00115,Deoxyribonuclease-2-alpha,DNASE2,Homo sapiens,"B2RD06, B7Z4K6, O43910",UP000005640,"Hydrolyzes DNA under acidic conditions with a preference for double-stranded DNA. Plays a major role in the clearance of nucleic acids generated through apoptosis, hence preventing autoinflammation (PubMed:29259162, PubMed:31775019). Necessary for proper fetal development and for definitive erythropoiesis in fetal liver and bone marrow, where it degrades nuclear DNA expelled from erythroid precursor cells (PubMed:29259162)"
O00116,"Alkyldihydroxyacetonephosphate synthase, peroxisomal",AGPS,Homo sapiens,"A5D8U9, Q2TU35",UP000005640,"Catalyzes the exchange of the acyl chain in acyl-dihydroxyacetonephosphate (acyl-DHAP) for a long chain fatty alcohol, yielding the first ether linked intermediate, i.e. alkyl-dihydroxyacetonephosphate (alkyl-DHAP), in the pathway of ether lipid biosynthesis"
O00159,Unconventional myosin-Ic,MYO1C,Homo sapiens,"Q4LE56, Q6NVJ7, Q86Y95",UP000005640,"Myosins are actin-based motor molecules with ATPase activity. Unconventional myosins serve in intracellular movements. Their highly divergent tails are presumed to bind to membranous compartments, which would be moved relative to actin filaments. Involved in glucose transporter recycling in response to insulin by regulating movement of intracellular GLUT4-containing vesicles to the plasma membrane. Component of the hair cell's (the sensory cells of the inner ear) adaptation-motor complex. Acts as a mediator of adaptation of mechanoelectrical transduction in stereocilia of vestibular hair cells. Binds phosphoinositides and links the actin cytoskeleton to cellular membranes"
O00161,Synaptosomal-associated protein 23,SNAP23,Homo sapiens,"O00162, Q13602, Q6IAE3",UP000005640,Essential component of the high affinity receptor for the general membrane fusion machinery and an important regulator of transport vesicle docking and fusion
O00165,HCLS1-associated protein X-1,HAX1,Homo sapiens,"A8W4W9, A8W4X0, B4DUJ7, Q5VYD5, Q5VYD7, Q96AU4, Q9BS80",UP000005640,Recruits the Arp2/3 complex to the cell cortex and regulates reorganization of the cortical actin cytoskeleton via its interaction with KCNC3 and the Arp2/3 complex (PubMed:26997484). Slows down the rate of inactivation of KCNC3 channels (PubMed:26997484). Promotes GNA13-mediated cell migration. Involved in the clathrin-mediated endocytosis pathway. May be involved in internalization of ABC transporters such as ABCB11. May inhibit CASP9 and CASP3. Promotes cell survival. May regulate intracellular calcium pools
O00168,Phospholemman,FXYD1,Homo sapiens,A8K196,UP000005640,"Associates with and regulates the activity of the sodium/potassium-transporting ATPase (NKA) which transports Na(+) out of the cell and K(+) into the cell. Inhibits NKA activity in its unphosphorylated state and stimulates activity when phosphorylated. Reduces glutathionylation of the NKA beta-1 subunit ATP1B1, thus reversing glutathionylation-mediated inhibition of ATP1B1. Contributes to female sexual development by maintaining the excitability of neurons which secrete gonadotropin-releasing hormone"
O00214,Galectin-8,LGALS8,Homo sapiens,"O15215, Q5T3P5, Q5T3Q4, Q8TEV1, Q96B92, Q9BXC8, Q9H584, Q9H585, Q9UEZ6, Q9UP32, Q9UP33, Q9UP34",UP000005640,"Beta-galactoside-binding lectin that acts as a sensor of membrane damage caused by infection and restricts the proliferation of infecting pathogens by targeting them for autophagy (PubMed:22246324, PubMed:28077878). Detects membrane rupture by binding beta-galactoside ligands located on the lumenal side of the endosome membrane; these ligands becoming exposed to the cytoplasm following rupture (PubMed:22246324, PubMed:28077878). Restricts infection by initiating autophagy via interaction with CALCOCO2/NDP52 (PubMed:22246324, PubMed:28077878). Required to restrict infection of bacterial invasion such as S.typhimurium (PubMed:22246324). Also required to restrict infection of Picornaviridae viruses (PubMed:28077878). Has a marked preference for 3'-O-sialylated and 3'-O-sulfated glycans (PubMed:21288902)"
O00237,E3 ubiquitin-protein ligase RNF103,RNF103,Homo sapiens,"A6NFV6, B2RAG4, Q53SU6, Q8IVB9",UP000005640,"Acts as an E2-dependent E3 ubiquitin-protein ligase, probably involved in the ER-associated protein degradation pathway"
O00254,Proteinase-activated receptor 3,F2RL2,Homo sapiens,"B2R754, B4DQ13, Q52M68, Q7Z3W3",UP000005640,Receptor for activated thrombin coupled to G proteins that stimulate phosphoinositide hydrolysis
O00268,Transcription initiation factor TFIID subunit 4,TAF4,Homo sapiens,"A6NGD9, Q5TBP6, Q99721, Q9BR40, Q9BX42",UP000005640,"The TFIID basal transcription factor complex plays a major role in the initiation of RNA polymerase II (Pol II)-dependent transcription (PubMed:33795473). TFIID recognizes and binds promoters with or without a TATA box via its subunit TBP, a TATA-box-binding protein, and promotes assembly of the pre-initiation complex (PIC) (PubMed:33795473). The TFIID complex consists of TBP and TBP-associated factors (TAFs), including TAF1, TAF2, TAF3, TAF4, TAF5, TAF6, TAF7, TAF8, TAF9, TAF10, TAF11, TAF12 and TAF13 (PubMed:10594036, PubMed:33795473, PubMed:8942982). TAF4 may maintain an association between the TFIID and TFIIA complexes, while bound to the promoter, together with TBP, during PIC assembly (PubMed:33795473). Potentiates transcriptional activation by the AF-2S of the retinoic acid, vitamin D3 and thyroid hormone (PubMed:9192867)"
