id,protein_name,gene_names,organism_name,accessions,proteome,function
O60469,Cell adhesion molecule DSCAM,DSCAM,Homo sapiens,O60468,UP000005640,"Cell adhesion molecule that plays a role in neuronal self-avoidance. Promotes repulsion between specific neuronal processes of either the same cell or the same subtype of cells. Mediates within retinal amacrine and ganglion cell subtypes both isoneuronal self-avoidance for creating an orderly dendritic arborization and heteroneuronal self-avoidance to maintain the mosaic spacing between amacrine and ganglion cell bodies (PubMed:10925149). Receptor for netrin required for axon guidance independently of and in collaboration with the receptor DCC. Might also collaborate with UNC5C in NTN1-mediated axon repulsion independently of DCC (By similarity). In spinal cord development plays a role in guiding commissural axons projection and pathfinding across the ventral midline to reach the floor plate upon ligand binding (PubMed:18585357, PubMed:19196994). Mediates intracellular signaling by stimulating the activation of MAPK8 and MAP kinase p38 (PubMed:18585357, PubMed:19196994). Adhesion molecule that promotes lamina-specific synaptic connections in the retina: expressed in specific subsets of interneurons and retinal ganglion cells (RGCs) and promotes synaptic connectivity via homophilic interactions (By similarity)"
O60481,Zinc finger protein ZIC 3,ZIC3,Homo sapiens,"B2CNW4, Q14DE5, Q5JY75",UP000005640,Acts as a transcriptional activator. Required in the earliest stages in both axial midline development and left-right (LR) asymmetry specification. Binds to the minimal GLI-consensus sequence 5'-GGGTGGTC-3'
O60502,Protein O-GlcNAcase,OGA,Homo sapiens,"B7WPB9, D3DR79, E9PGF9, O75166, Q86WV0, Q8IV98, Q9BVA5, Q9HAR0",UP000005640,"Cleaves GlcNAc but not GalNAc from O-glycosylated proteins (PubMed:11148210, PubMed:11788610, PubMed:20673219, PubMed:22365600, PubMed:24088714, PubMed:28939839, PubMed:37962578). Deglycosylates a large and diverse number of proteins, such as CRYAB, ELK1, GSDMD, LMNB1 and TAB1 (PubMed:28939839, PubMed:37962578). Can use p-nitrophenyl-beta-GlcNAc and 4-methylumbelliferone-GlcNAc as substrates but not p-nitrophenyl-beta-GalNAc or p-nitrophenyl-alpha-GlcNAc (in vitro) (PubMed:20673219). Does not bind acetyl-CoA and does not have histone acetyltransferase activity (PubMed:24088714)"
O60519,cAMP-responsive element-binding protein-like 2,CREBL2,Homo sapiens,B5BUM5,UP000005640,Probable regulator of CREB1 transcriptional activity which is involved in adipose cells differentiation. May also play a regulatory role in the cell cycle. Identification in a chromosomal region frequently deleted in various cancers suggests that it might act as a tumor suppressor
O60548,Forkhead box protein D2,FOXD2,Homo sapiens,Q5SVZ3,UP000005640,Probable transcription factor involved in embryogenesis and somatogenesis
O60568,Multifunctional procollagen lysine hydroxylase and glycosyltransferase LH3,PLOD3,Homo sapiens,"B2R6W6, Q540C3",UP000005640,"Multifunctional enzyme that catalyzes a series of essential post-translational modifications on Lys residues in procollagen (PubMed:11956192, PubMed:12475640, PubMed:18298658, PubMed:18834968, PubMed:30089812). Plays a redundant role in catalyzing the formation of hydroxylysine residues in -Xaa-Lys-Gly- sequences in collagens (PubMed:11956192, PubMed:12475640, PubMed:18298658, PubMed:18834968, PubMed:30089812, PubMed:9582318, PubMed:9724729). Plays a redundant role in catalyzing the transfer of galactose onto hydroxylysine groups, giving rise to galactosyl 5-hydroxylysine (PubMed:12475640, PubMed:18298658, PubMed:18834968, PubMed:30089812). Has an essential role by catalyzing the subsequent transfer of glucose moieties, giving rise to 1,2-glucosylgalactosyl-5-hydroxylysine residues (PubMed:10934207, PubMed:11896059, PubMed:11956192, PubMed:12475640, PubMed:18298658, PubMed:18834968, PubMed:30089812). Catalyzes hydroxylation and glycosylation of Lys residues in the MBL1 collagen-like domain, giving rise to hydroxylysine and 1,2-glucosylgalactosyl-5-hydroxylysine residues (PubMed:25419660). Essential for normal biosynthesis and secretion of type IV collagens (Probable) (PubMed:18834968). Essential for normal formation of basement membranes (By similarity)"
O60635,Tetraspanin-1,TSPAN1,Homo sapiens,"D3DQ14, O60745, Q5VST0",UP000005640,"Structural component of specialized membrane microdomains known as tetraspanin-enriched microdomains (TERMs), which act as platforms for receptor clustering and signaling. Participates thereby in diverse biological functions such as cell signal transduction, adhesion, migration and protein trafficking (PubMed:30066932, PubMed:30291375). Regulates neuronal differentiation in response to NGF by facilitating NGF-mediated activation of NTRK1/TRKA receptor tyrosine kinase and subsequent downstream signaling pathways (By similarity). Plays a role in the inhibition of TNFalpha-induced apoptosis. Mechanistically, inhibits the NF-kappa-B signaling pathway by blocking phosphorylation of CHUK (PubMed:30291375). Promotes also the stability of the thiamine transporter 1/SLC19A2 in intestinal epithelial cells leading to an increase of thiamine uptake process (PubMed:21836059)"
O60636,Tetraspanin-2,TSPAN2,Homo sapiens,"D6PTH4, Q5TET2, Q8WU05",UP000005640,May play a role in signalling in oligodendrocytes in the early stages of their terminal differentiation into myelin-forming glia and may also function in stabilizing the mature sheath
O60667,Immunoglobulin mu Fc receptor,FCMR,Homo sapiens,"A8K7J2, B7Z6Z0, D9MWM3",UP000005640,"High-affinity Fc receptor for immunoglobulin M (IgM), both secreted and membrane-bound IgM (PubMed:19858324, PubMed:22675200, PubMed:36949194, PubMed:37095205). Primarily regulates IgM transport and homeostasis. In lymphoid cells, enables exocytosis of membrane-bound IgM on the plasma membrane as well as endocytosis of IgM-antigen complexes toward lysosomes for degradation. In mucosal epithelium, mediates retrotranscytosis of antigen-IgM complexes across mucosal M cells toward antigen-presenting cells in mucosal lymphoid tissues (PubMed:21908732, PubMed:28230186). Triggers costimulatory signaling and mediates most of IgM effector functions involved in B cell development and primary immune response to infection. Likely limits tonic IgM BCR signaling to self-antigens for proper negative selection of autoreactive B cells in the bone marrow and for the maintenance of regulatory B cell pool in peripheral lymphoid organs. Mediates antibody responses to T cell-dependent and T cell-independent antigens and promotes induction of an efficient neutralizing IgG response. Engages in cross-talk with antigen-receptor signaling via the non-canonical NF-kappa-B, MAP kinases and calcium signaling pathways (PubMed:19858324, PubMed:22675200, PubMed:25601920, PubMed:30840890)"
O60678,Protein arginine N-methyltransferase 3,PRMT3,Homo sapiens,"A0A0A0MSN7, B4DUC7",UP000005640,"Protein-arginine N-methyltransferase that catalyzes both the monomethylation and asymmetric dimethylation of the guanidino nitrogens of arginine residues in target proteins, and therefore falls into the group of type I methyltransferases (Probable). May regulate retinoic acid synthesis and signaling by inhibiting ALDH1A1 retinal dehydrogenase activity (PubMed:33495566)"
O60682,Musculin,MSC,Homo sapiens,"O75946, Q53XZ2, Q9BRE7",UP000005640,Transcription repressor capable of inhibiting the transactivation capability of TCF3/E47. May play a role in regulating antigen-dependent B-cell differentiation
O60687,Sushi repeat-containing protein SRPX2,SRPX2,Homo sapiens,"B3KQT3, Q8WW85",UP000005640,"Acts as a ligand for the urokinase plasminogen activator surface receptor. Plays a role in angiogenesis by inducing endothelial cell migration and the formation of vascular network (cords). Involved in cellular migration and adhesion. Increases the phosphorylation levels of FAK. Interacts with and increases the mitogenic activity of HGF. Promotes synapse formation. May have a role in the perisylvian region, critical for language and cognitive development"
O60706,ATP-binding cassette sub-family C member 9,ABCC9,Homo sapiens,O60707,UP000005640,Subunit of ATP-sensitive potassium channels (KATP). Can form cardiac and smooth muscle-type KATP channels with KCNJ11. KCNJ11 forms the channel pore while ABCC9 is required for activation and regulation
O60729,Dual specificity protein phosphatase CDC14B,CDC14B,Homo sapiens,"A6N5X8, A8MQ20, B1AL31, B1AL32, O43183, O60730, Q5JU08",UP000005640,"Dual-specificity phosphatase involved in DNA damage response. Essential regulator of the G2 DNA damage checkpoint: following DNA damage, translocates to the nucleus and dephosphorylates FZR1/CDH1, a key activator of the anaphase promoting complex/cyclosome (APC/C). Dephosphorylates SIRT2 around early anaphase. Dephosphorylation of FZR1/CDH1 activates the APC/C, leading to the ubiquitination of PLK1, preventing entry into mitosis. Preferentially dephosphorylates proteins modified by proline-directed kinases"
O60741,Potassium/sodium hyperpolarization-activated cyclic nucleotide-gated channel 1,HCN1,Homo sapiens,,UP000005640,"Hyperpolarization-activated ion channel that are permeable to sodium and potassium ions (PubMed:15351778, PubMed:28086084). Displays lower selectivity for K(+) over Na(+) ions (PubMed:28086084). Contributes to the native pacemaker currents in heart (If) and in the generation of the I(h) current which controls neuron excitability (PubMed:29936235, PubMed:30351409). Participates in cerebellar mechanisms of motor learning (By similarity). May mediate responses to sour stimuli (By similarity)"
O60759,Cytohesin-interacting protein,CYTIP,Homo sapiens,"B4DWH9, Q15630, Q8NE32",UP000005640,"By its binding to cytohesin-1 (CYTH1), it modifies activation of ARFs by CYTH1 and its precise function may be to sequester CYTH1 in the cytoplasm"
O60784,Target of Myb1 membrane trafficking protein,TOM1,Homo sapiens,"B4DEL9, B4DNA1, Q5TIJ6, Q86X74",UP000005640,"Adapter protein that plays a role in the intracellular membrane trafficking of ubiquitinated proteins, thereby participating in autophagy, ubiquitination-dependent signaling and receptor recycling pathways (PubMed:14563850, PubMed:15047686, PubMed:23023224, PubMed:25588840, PubMed:26320582, PubMed:31371777). Acts as a MYO6/Myosin VI adapter protein that targets MYO6 to endocytic structures (PubMed:23023224). Together with MYO6, required for autophagosomal delivery of endocytic cargo, the maturation of autophagosomes and their fusion with lysosomes (PubMed:23023224). MYO6 links TOM1 with autophagy receptors, such as TAX1BP1; CALCOCO2/NDP52 and OPTN (PubMed:31371777). Binds to polyubiquitinated proteins via its GAT domain (PubMed:14563850). In a complex with TOLLIP, recruits ubiquitin-conjugated proteins onto early endosomes (PubMed:15047686). The Tom1-Tollip complex may regulate endosomal trafficking by linking polyubiquitinated proteins to clathrin (PubMed:14563850, PubMed:15047686). Mediates clathrin recruitment to early endosomes by ZFYVE16 (PubMed:15657082). Modulates binding of TOLLIP to phosphatidylinositol 3-phosphate (PtdIns(3)P) via binding competition; the association with TOLLIP may favor the release of TOLLIP from endosomal membranes, allowing TOLLIP to commit to cargo trafficking (PubMed:26320582). Acts as a phosphatidylinositol 5-phosphate (PtdIns(5)P) effector by binding to PtdIns(5)P, thereby regulating endosomal maturation (PubMed:25588840). PtdIns(5)P-dependent recruitment to signaling endosomes may block endosomal maturation (PubMed:25588840). Also inhibits Toll-like receptor (TLR) signaling and participates in immune receptor recycling (PubMed:15047686, PubMed:26320582)"
O60814,Histone H2B type 1-K,H2BC12,Homo sapiens,"A8K7P7, Q2VPI7",UP000005640,"Core component of nucleosome. Nucleosomes wrap and compact DNA into chromatin, limiting DNA accessibility to the cellular machineries which require DNA as a template. Histones thereby play a central role in transcription regulation, DNA repair, DNA replication and chromosomal stability. DNA accessibility is regulated via a complex set of post-translational modifications of histones, also called histone code, and nucleosome remodeling"
O60831,PRA1 family protein 2,PRAF2,Homo sapiens,B2RD20,UP000005640,May be involved in ER/Golgi transport and vesicular traffic. Plays a proapoptotic role in cerulenin-induced neuroblastoma apoptosis
O60879,Protein diaphanous homolog 2,DIAPH2,Homo sapiens,"A6NG19, O60878, Q8WX06, Q8WX48, Q9UJL2",UP000005640,"Could be involved in oogenesis. Involved in the regulation of endosome dynamics. Implicated in a novel signal transduction pathway, in which isoform 3 and CSK are sequentially activated by RHOD to regulate the motility of early endosomes through interactions with the actin cytoskeleton"
O60882,Matrix metalloproteinase-20,MMP20,Homo sapiens,Q6DKT9,UP000005640,"Degrades amelogenin, the major protein component of the enamel matrix and two of the macromolecules characterizing the cartilage extracellular matrix: aggrecan and the cartilage oligomeric matrix protein (COMP). May play a central role in tooth enamel formation. Cleaves aggrecan at the '360-Asn-|-Phe-361' site"
O60884,DnaJ homolog subfamily A member 2,DNAJA2,Homo sapiens,"B2R7L7, O14711",UP000005640,Co-chaperone of Hsc70. Stimulates ATP hydrolysis and the folding of unfolded proteins mediated by HSPA1A/B (in vitro) (PubMed:24318877)
O60909,"Beta-1,4-galactosyltransferase 2",B4GALT2,Homo sapiens,"B3KTP0, B4DE14, D3DPY6, D3DPY7, O60511, Q4V9L9, Q5T4X5, Q5T4Y5, Q9BUP6, Q9NSY7",UP000005640,Responsible for the synthesis of complex-type N-linked oligosaccharides in many glycoproteins as well as the carbohydrate moieties of glycolipids (PubMed:9405390). Can produce lactose (PubMed:9405390)
O60921,Checkpoint protein HUS1,HUS1,Homo sapiens,B4DFI9,UP000005640,"Component of the 9-1-1 cell-cycle checkpoint response complex that plays a major role in DNA repair (PubMed:21659603). The 9-1-1 complex is recruited to DNA lesion upon damage by the RAD17-replication factor C (RFC) clamp loader complex (PubMed:21659603). Acts then as a sliding clamp platform on DNA for several proteins involved in long-patch base excision repair (LP-BER) (PubMed:21659603). The 9-1-1 complex stimulates DNA polymerase beta (POLB) activity by increasing its affinity for the 3'-OH end of the primer-template and stabilizes POLB to those sites where LP-BER proceeds; endonuclease FEN1 cleavage activity on substrates with double, nick, or gap flaps of distinct sequences and lengths; and DNA ligase I (LIG1) on long-patch base excision repair substrates (PubMed:21659603). The 9-1-1 complex is necessary for the recruitment of RHNO1 to sites of double-stranded breaks (DSB) occurring during the S phase (PubMed:21659603)"
O60930,Ribonuclease H1,RNASEH1,Homo sapiens,"B3KQU4, O60523, O60857, Q57Z93, Q5U0C1, Q6FHD4",UP000005640,Endonuclease that specifically degrades the RNA of RNA-DNA hybrids (PubMed:10497183). Plays a role in RNA polymerase II (RNAp II) transcription termination by degrading R-loop RNA-DNA hybrid formation at G-rich pause sites located downstream of the poly(A) site and behind the elongating RNAp II (PubMed:21700224)
O60938,Keratocan,KERA,Homo sapiens,,UP000005640,May be important in developing and maintaining corneal transparency and for the structure of the stromal matrix
O60939,Sodium channel regulatory subunit beta-2,SCN2B,Homo sapiens,"O75302, Q9UNN3",UP000005640,"Regulatory subunit of multiple voltage-gated sodium (Nav) channels directly mediating the depolarization of excitable membranes (PubMed:19808477, PubMed:23559163, PubMed:26894959, PubMed:30765605, PubMed:30765606, PubMed:35277491, PubMed:36823201). Navs, also called VGSCs (voltage-gated sodium channels) or VDSCs (voltage-dependent sodium channels), operate by switching between closed and open conformations depending on the voltage difference across the membrane. In the open conformation they allow Na(+) ions to selectively pass through the pore, along their electrochemical gradient. The influx of Na+ ions provokes membrane depolarization, initiating the propagation of electrical signals throughout cells and tissues (PubMed:19808477, PubMed:23559163, PubMed:26894959). The accessory beta subunits participate in localization and functional modulation of the Nav channels (PubMed:19808477, PubMed:23559163). Modulates the activity of SCN1A/Nav1.1, SCN2A/Nav1.2, SCN2A/Nav1.3, SCN5A/Nav1.5, SCN8A/Nav1.6, SCN9A/Nav1.7 and SCN10A/Nav1.8 (PubMed:19808477, PubMed:23559163, PubMed:26894959, PubMed:30765605, PubMed:30765606, PubMed:35277491, PubMed:36823201)"
O60941,Dystrobrevin beta,DTNB,Homo sapiens,"B7Z733, F5GZG4, G5E9F6, O43782, O60881, O75538, Q86VR4, Q96AW0, Q9UE14, Q9UE15, Q9UE16",UP000005640,"Scaffolding protein that assembles DMD and SNTA1 molecules to the basal membrane of kidney cells and liver sinusoids (By similarity). May function as a repressor of the SYN1 promoter through the binding of repressor element-1 (RE-1), in turn regulates SYN1 expression and may be involved in cell proliferation regulation during the early phase of neural differentiation (PubMed:27223470). May be required for proper maturation and function of a subset of inhibitory synapses (By similarity)"
O60942,mRNA-capping enzyme,RNGTT,Homo sapiens,"E1P513, E1P514, O43483, O60257, O60351, Q5TCW8, Q8WUM8",UP000005640,"Bifunctional mRNA-capping enzyme exhibiting RNA 5'-triphosphate monophosphatase activity in the N-terminal part and mRNA guanylyltransferase activity in the C-terminal part. Catalyzes the first two steps of cap formation: by removing the gamma-phosphate from the 5'-triphosphate end of nascent mRNA to yield a diphosphate end, and by transferring the GMP moiety of GTP to the 5'-diphosphate terminus of RNA via a covalent enzyme-GMP reaction intermediate"
O75019,Leukocyte immunoglobulin-like receptor subfamily A member 1,LILRA1,Homo sapiens,"O75018, Q3MJA6",UP000005640,May act as receptor for class I MHC antigens
O75022,Leukocyte immunoglobulin-like receptor subfamily B member 3,LILRB3,Homo sapiens,"C9J1P3, C9JIP1, O15471, Q86U49",UP000005640,"May act as receptor for class I MHC antigens. Becomes activated upon coligation of LILRB3 and immune receptors, such as FCGR2B and the B-cell receptor. Down-regulates antigen-induced B-cell activation by recruiting phosphatases to its immunoreceptor tyrosine-based inhibitor motifs (ITIM)"
O75072,Ribitol-5-phosphate transferase FKTN,FKTN,Homo sapiens,"B4DUX9, J3KP13, Q3MIJ1, Q96TE1, Q9P295",UP000005640,"Catalyzes the transfer of a ribitol-phosphate from CDP-ribitol to the distal N-acetylgalactosamine of the phosphorylated O-mannosyl trisaccharide (N-acetylgalactosamine-beta-3-N-acetylglucosamine-beta-4-(phosphate-6-)mannose), a carbohydrate structure present in alpha-dystroglycan (DAG1) (PubMed:26923585, PubMed:27194101, PubMed:29477842). This constitutes the first step in the formation of the ribitol 5-phosphate tandem repeat which links the phosphorylated O-mannosyl trisaccharide to the ligand binding moiety composed of repeats of 3-xylosyl-alpha-1,3-glucuronic acid-beta-1 (PubMed:17034757, PubMed:25279699, PubMed:26923585, PubMed:27194101, PubMed:29477842). Required for normal location of POMGNT1 in Golgi membranes, and for normal POMGNT1 activity (PubMed:17034757). May interact with and reinforce a large complex encompassing the outside and inside of muscle membranes (PubMed:25279699). Could be involved in brain development (Probable)"
O75077,Disintegrin and metalloproteinase domain-containing protein 23,ADAM23,Homo sapiens,A2RU59,UP000005640,May play a role in cell-cell and cell-matrix interactions. This is a non-catalytic metalloprotease-like protein
O75132,Zinc finger BED domain-containing protein 4,ZBED4,Homo sapiens,"B2RZH1, Q1ECU0, Q9UGG8",UP000005640,Transcriptional regulator that binds to poly-guanine tracts in gene promoters and activates transcription (By similarity). Able to bind single- and double-stranded DNA and RNA (By similarity)
O75151,Lysine-specific demethylase PHF2,PHF2,Homo sapiens,"Q4VXG0, Q8N3K2, Q9Y6N4",UP000005640,"Lysine demethylase that demethylates both histones and non-histone proteins (PubMed:20129925, PubMed:21167174, PubMed:21532585). Enzymatically inactive by itself, and becomes active following phosphorylation by PKA: forms a complex with ARID5B and mediates demethylation of methylated ARID5B (PubMed:21532585). Demethylation of ARID5B leads to target the PHF2-ARID5B complex to target promoters, where PHF2 mediates demethylation of dimethylated 'Lys-9' of histone H3 (H3K9me2), followed by transcription activation of target genes (PubMed:21532585). The PHF2-ARID5B complex acts as a coactivator of HNF4A in liver. PHF2 is recruited to trimethylated 'Lys-4' of histone H3 (H3K4me3) at rDNA promoters and promotes expression of rDNA (PubMed:21532585). Involved in the activation of toll-like receptor 4 (TLR4)-target inflammatory genes in macrophages by catalyzing the demethylation of trimethylated histone H4 lysine 20 (H4K20me3) at the gene promoters (By similarity)"
O75159,Suppressor of cytokine signaling 5,SOCS5,Homo sapiens,"Q53SD4, Q8IYZ4",UP000005640,SOCS family proteins form part of a classical negative feedback system that regulates cytokine signal transduction. May be a substrate-recognition component of a SCF-like ECS (Elongin BC-CUL2/5-SOCS-box protein) E3 ubiquitin-protein ligase complex which mediates the ubiquitination and subsequent proteasomal degradation of target proteins. Inhibits for instance EGF signaling by mediating the degradation of the EGF receptor/EGFR. Involved in the regulation of T-helper cell differentiation by inhibiting of the IL4 signaling pathway which promotes differentiation into the Th2 phenotype. Can also partially inhibit IL6 and LIF signaling
O75175,CCR4-NOT transcription complex subunit 3,CNOT3,Homo sapiens,"Q9NZN7, Q9UF76",UP000005640,"Component of the CCR4-NOT complex which is one of the major cellular mRNA deadenylases and is linked to various cellular processes including bulk mRNA degradation, miRNA-mediated repression, translational repression during translational initiation and general transcription regulation. Additional complex functions may be a consequence of its influence on mRNA expression. May be involved in metabolic regulation; may be involved in recruitment of the CCR4-NOT complex to deadenylation target mRNAs involved in energy metabolism. Involved in mitotic progression and regulation of the spindle assembly checkpoint by regulating the stability of MAD1L1 mRNA. Can repress transcription and may link the CCR4-NOT complex to transcriptional regulation; the repressive function may involve histone deacetylases. Involved in the maintenance of embryonic stem (ES) cell identity"
O75177,Calcium-responsive transactivator,SS18L1,Homo sapiens,"A6NNE3, A8K620, B3KWR8, E1P5H7, Q5JXJ3, Q6MZV9, Q6NTH3, Q6XYD9, Q8NE69, Q9BR55, Q9H4K6",UP000005640,"Transcriptional activator which is required for calcium-dependent dendritic growth and branching in cortical neurons. Recruits CREB-binding protein (CREBBP) to nuclear bodies. Component of the CREST-BRG1 complex, a multiprotein complex that regulates promoter activation by orchestrating a calcium-dependent release of a repressor complex and a recruitment of an activator complex. In resting neurons, transcription of the c-FOS promoter is inhibited by BRG1-dependent recruitment of a phospho-RB1-HDAC1 repressor complex. Upon calcium influx, RB1 is dephosphorylated by calcineurin, which leads to release of the repressor complex. At the same time, there is increased recruitment of CREBBP to the promoter by a CREST-dependent mechanism, which leads to transcriptional activation. The CREST-BRG1 complex also binds to the NR2B promoter, and activity-dependent induction of NR2B expression involves a release of HDAC1 and recruitment of CREBBP (By similarity)"
O75190,DnaJ homolog subfamily B member 6,DNAJB6,Homo sapiens,"A4D232, A8K7D8, A8KAG0, B4DN73, E9PCZ2, O95806, Q53EN8, Q59EF2, Q6FIC8, Q75MA2, Q9UIK6",UP000005640,"Has a stimulatory effect on the ATPase activity of HSP70 in a dose-dependent and time-dependent manner and hence acts as a co-chaperone of HSP70 (PubMed:10954706, PubMed:28233300). Plays an indispensable role in the organization of KRT8/KRT18 filaments (PubMed:10954706). Acts as an endogenous molecular chaperone for neuronal proteins including huntingtin (PubMed:11896048, PubMed:22366786). Suppresses aggregation and toxicity of polyglutamine-containing, aggregation-prone proteins (PubMed:20159555, PubMed:22366786). Also reduces cellular toxicity and caspase-3 activity (PubMed:11896048)"
O75191,Xylulose kinase,XYLB,Homo sapiens,"B2RAW4, B4DDT2, B9EH64",UP000005640,"Phosphorylates D-xylulose to produce D-xylulose 5-phosphate, a molecule that may play an important role in the regulation of glucose metabolism and lipogenesis"
O75309,Cadherin-16,CDH16,Homo sapiens,"B4DPA8, H3BPD3, Q6UW93",UP000005640,Cadherins are calcium-dependent cell adhesion proteins. They preferentially interact with themselves in a homophilic manner in connecting cells; cadherins may thus contribute to the sorting of heterogeneous cell types
O75319,RNA/RNP complex-1-interacting phosphatase,DUSP11,Homo sapiens,"B2RCT8, C9JYA6, Q6AI47, Q9BWE3",UP000005640,"Possesses RNA 5'-triphosphatase and diphosphatase activities, but displays a poor protein-tyrosine phosphatase activity. In addition, has phosphatase activity with ATP, ADP and O-methylfluorescein phosphate (in vitro). Binds to RNA. May participate in nuclear mRNA metabolism"
