id,protein_name,gene_names,organism_name,accessions,proteome,function
O15067,Phosphoribosylformylglycinamidine synthase,PFAS,Homo sapiens,A6H8V8,UP000005640,Phosphoribosylformylglycinamidine synthase involved in the purines biosynthetic pathway. Catalyzes the ATP-dependent conversion of formylglycinamide ribonucleotide (FGAR) and glutamine to yield formylglycinamidine ribonucleotide (FGAM) and glutamate
O15078,Centrosomal protein of 290 kDa,CEP290,Homo sapiens,"Q1PSK5, Q66GS8, Q9H2G6, Q9H6Q7, Q9H8I0",UP000005640,"Involved in early and late steps in cilia formation. Its association with CCP110 is required for inhibition of primary cilia formation by CCP110 (PubMed:18694559). May play a role in early ciliogenesis in the disappearance of centriolar satellites and in the transition of primary ciliar vesicles (PCVs) to capped ciliary vesicles (CCVs). Required for the centrosomal recruitment of RAB8A and for the targeting of centriole satellite proteins to centrosomes such as of PCM1 (PubMed:24421332). Required for the correct localization of ciliary and phototransduction proteins in retinal photoreceptor cells; may play a role in ciliary transport processes (By similarity). Required for efficient recruitment of RAB8A to primary cilium (PubMed:17705300). In the ciliary transition zone is part of the tectonic-like complex which is required for tissue-specific ciliogenesis and may regulate ciliary membrane composition (By similarity). Involved in regulation of the BBSome complex integrity, specifically for presence of BBS2, BBS5 and BBS8/TTC8 in the complex, and in ciliary targeting of selected BBSome cargos. May play a role in controlling entry of the BBSome complex to cilia possibly implicating IQCB1/NPHP5 (PubMed:25552655). Activates ATF4-mediated transcription (PubMed:16682973)"
O15111,Inhibitor of nuclear factor kappa-B kinase subunit alpha,CHUK,Homo sapiens,"O14666, Q13132, Q5W0I4, Q92467",UP000005640,"Serine kinase that plays an essential role in the NF-kappa-B signaling pathway which is activated by multiple stimuli such as inflammatory cytokines, bacterial or viral products, DNA damages or other cellular stresses (PubMed:18626576, PubMed:9244310, PubMed:9252186, PubMed:9346484). Acts as a part of the canonical IKK complex in the conventional pathway of NF-kappa-B activation and phosphorylates inhibitors of NF-kappa-B on serine residues (PubMed:18626576, PubMed:35952808, PubMed:9244310, PubMed:9252186, PubMed:9346484). These modifications allow polyubiquitination of the inhibitors and subsequent degradation by the proteasome (PubMed:18626576, PubMed:9244310, PubMed:9252186, PubMed:9346484). In turn, free NF-kappa-B is translocated into the nucleus and activates the transcription of hundreds of genes involved in immune response, growth control, or protection against apoptosis (PubMed:18626576, PubMed:9244310, PubMed:9252186, PubMed:9346484). Negatively regulates the pathway by phosphorylating the scaffold protein TAXBP1 and thus promoting the assembly of the A20/TNFAIP3 ubiquitin-editing complex (composed of A20/TNFAIP3, TAX1BP1, and the E3 ligases ITCH and RNF11) (PubMed:21765415). Therefore, CHUK plays a key role in the negative feedback of NF-kappa-B canonical signaling to limit inflammatory gene activation. As part of the non-canonical pathway of NF-kappa-B activation, the MAP3K14-activated CHUK/IKKA homodimer phosphorylates NFKB2/p100 associated with RelB, inducing its proteolytic processing to NFKB2/p52 and the formation of NF-kappa-B RelB-p52 complexes (PubMed:20501937). In turn, these complexes regulate genes encoding molecules involved in B-cell survival and lymphoid organogenesis. Participates also in the negative feedback of the non-canonical NF-kappa-B signaling pathway by phosphorylating and destabilizing MAP3K14/NIK. Within the nucleus, phosphorylates CREBBP and consequently increases both its transcriptional and histone acetyltransferase activities (PubMed:17434128). Modulates chromatin accessibility at NF-kappa-B-responsive promoters by phosphorylating histones H3 at 'Ser-10' that are subsequently acetylated at 'Lys-14' by CREBBP (PubMed:12789342). Additionally, phosphorylates the CREBBP-interacting protein NCOA3. Also phosphorylates FOXO3 and may regulate this pro-apoptotic transcription factor (PubMed:15084260). Phosphorylates RIPK1 at 'Ser-25' which represses its kinase activity and consequently prevents TNF-mediated RIPK1-dependent cell death (By similarity). Phosphorylates AMBRA1 following mitophagy induction, promoting AMBRA1 interaction with ATG8 family proteins and its mitophagic activity (PubMed:30217973)"
O15116,U6 snRNA-associated Sm-like protein LSm1,LSM1,Homo sapiens,B2R5E6,UP000005640,"Plays a role in the degradation of histone mRNAs, the only eukaryotic mRNAs that are not polyadenylated (PubMed:18172165). Probably also part of an LSm subunits-containing complex involved in the general process of mRNA degradation (By similarity)"
O15119,T-box transcription factor TBX3,TBX3,Homo sapiens,"Q8TB20, Q9UKF8",UP000005640,"Transcriptional repressor involved in developmental processes (PubMed:10468588). Binds to the palindromic T site 5'-TTCACACCTAGGTGTGAA-3' DNA sequence, or a half-site, which are present in the regulatory region of several genes (PubMed:12000749). Probably plays a role in limb pattern formation (PubMed:10468588). Required for mammary placode induction, and maintenance of the mammary buds during development (By similarity). Involved in branching morphogenesis in both developing lungs and adult mammary glands, via negative modulation of target genes; acting redundantly with TBX2 (By similarity). Required, together with TBX2, to maintain cell proliferation in the embryonic lung mesenchyme; perhaps acting downstream of SHH, BMP and TGFbeta signaling (By similarity). Involved in modulating early inner ear development, acting independently of, and also redundantly with, TBX2 in different subregions of the developing ear (By similarity). Acts as a negative regulator of PML function in cellular senescence (PubMed:22002537)"
O15120,1-acyl-sn-glycerol-3-phosphate acyltransferase beta,AGPAT2,Homo sapiens,"O00516, O15106, Q5VUD3, Q5VUD4, Q9BSV7, Q9BWR7",UP000005640,"Converts 1-acyl-sn-glycerol-3-phosphate (lysophosphatidic acid or LPA) into 1,2-diacyl-sn-glycerol-3-phosphate (phosphatidic acid or PA) by incorporating an acyl moiety at the sn-2 position of the glycerol backbone"
O15127,Secretory carrier-associated membrane protein 2,SCAMP2,Homo sapiens,"B2RDF0, Q9BQE8",UP000005640,Functions in post-Golgi recycling pathways. Acts as a recycling carrier to the cell surface
O15156,Zinc finger and BTB domain-containing protein 7B,ZBTB7B,Homo sapiens,"B4E3K5, D3DV83, J3KQQ3, Q68DR2, Q96EP2",UP000005640,"Transcription regulator that acts as a key regulator of lineage commitment of immature T-cell precursors. Exerts distinct biological functions in the mammary epithelial cells and T cells in a tissue-specific manner. Necessary and sufficient for commitment of CD4 lineage, while its absence causes CD8 commitment. Development of immature T-cell precursors (thymocytes) to either the CD4 helper or CD8 killer T-cell lineages correlates precisely with their T-cell receptor specificity for major histocompatibility complex class II or class I molecules, respectively. Cross-antagonism between ZBTB7B and CBF complexes are determinative to CD4 versus CD8 cell fate decision. Suppresses RUNX3 expression and imposes CD4+ lineage fate by inducing the SOCS suppressors of cytokine signaling. induces, as a transcriptional activator, SOCS genes expression which represses RUNX3 expression and promotes the CD4+ lineage fate. During CD4 lineage commitment, associates with multiple sites at the CD8 locus, acting as a negative regulator of the CD8 promoter and enhancers by epigenetic silencing through the recruitment of class II histone deacetylases, such as HDAC4 and HDAC5, to these loci. Regulates the development of IL17-producing CD1d-restricted naural killer (NK) T cells. Also functions as an important metabolic regulator in the lactating mammary glands. Critical feed-forward regulator of insulin signaling in mammary gland lactation, directly regulates expression of insulin receptor substrate-1 (IRS-1) and insulin-induced Akt-mTOR-SREBP signaling (By similarity). Transcriptional repressor of the collagen COL1A1 and COL1A2 genes. May also function as a repressor of fibronectin and possibly other extracellular matrix genes (PubMed:9370309). Potent driver of brown fat development, thermogenesis and cold-induced beige fat formation. Recruits the brown fat lncRNA 1 (Blnc1):HNRNPU ribonucleoprotein complex to activate thermogenic gene expression in brown and beige adipocytes (By similarity)"
O15162,Phospholipid scramblase 1,PLSCR1,Homo sapiens,"B2R8H8, B4DTE8",UP000005640,"Catalyzes calcium-induced ATP-independent rapid bidirectional and non-specific movement of phospholipids (lipid scrambling or lipid flip-flop) between the inner and outer leaflet of the plasma membrane resulting in collapse of the phospholipid asymmetry which leads to phosphatidylserine externalization on the cell surface (PubMed:10770950, PubMed:18629440, PubMed:23590222, PubMed:23659204, PubMed:24343571, PubMed:24648509, PubMed:29748552, PubMed:32110987, PubMed:8663431, PubMed:9218461, PubMed:9485382, PubMed:9572851). Mediates calcium-dependent phosphatidylserine externalization and apoptosis in neurons via its association with TRPC5 (By similarity). Also exhibits magnesium-dependent nuclease activity against double-stranded DNA and RNA but not single-stranded DNA and can enhance DNA decatenation mediated by TOP2A (PubMed:17567603, PubMed:27206388). Negatively regulates FcR-mediated phagocytosis in differentiated macrophages (PubMed:26745724). May contribute to cytokine-regulated cell proliferation and differentiation (By similarity). May play a role in the antiviral response of interferon (IFN) by amplifying and enhancing the IFN response through increased expression of select subset of potent antiviral genes (PubMed:15308695). Inhibits the functions of viral transactivators, including human T-cell leukemia virus (HTLV)-1 protein Tax, human immunodeficiency virus (HIV)-1 Tat, human hepatitis B virus (HBV) HBx, Epstein-Barr virus (EBV) BZLF1 and human cytomegalovirus IE1 and IE2 proteins through direct interactions (PubMed:22789739, PubMed:23501106, PubMed:25365352, PubMed:31434743, PubMed:35138119). Mediates also the inhibition of influenza virus infection by preventing nuclear import of the viral nucleoprotein/NP (PubMed:29352288, PubMed:35595813). Plays a crucial role as a defense factor against SARS-CoV-2 independently of its scramblase activity by directly targeting nascent viral vesicles to prevent virus-membrane fusion and the release of viral RNA into the host-cell cytosol (PubMed:37438530)"
O15169,Axin-1,AXIN1,Homo sapiens,"Q4TT26, Q4TT27, Q86YA7, Q8WVW6, Q96S28",UP000005640,"Component of the beta-catenin destruction complex required for regulating CTNNB1 levels through phosphorylation and ubiquitination, and modulating Wnt-signaling (PubMed:12192039, PubMed:27098453, PubMed:28829046). Controls dorsoventral patterning via two opposing effects; down-regulates CTNNB1 to inhibit the Wnt signaling pathway and ventralize embryos, but also dorsalizes embryos by activating a Wnt-independent JNK signaling pathway (PubMed:12192039). In Wnt signaling, probably facilitates the phosphorylation of CTNNB1 and APC by GSK3B (PubMed:12192039). Likely to function as a tumor suppressor. Enhances TGF-beta signaling by recruiting the RNF111 E3 ubiquitin ligase and promoting the degradation of inhibitory SMAD7 (PubMed:16601693). Also a component of the AXIN1-HIPK2-TP53 complex which controls cell growth, apoptosis and development (PubMed:17210684). Facilitates the phosphorylation of TP53 by HIPK2 upon ultraviolet irradiation (PubMed:17210684)"
O15230,Laminin subunit alpha-5,LAMA5,Homo sapiens,"Q5U4N9, Q8TDF8, Q8WZA7, Q9H1P1",UP000005640,"Binding to cells via a high affinity receptor, laminin is thought to mediate the attachment, migration and organization of cells into tissues during embryonic development by interacting with other extracellular matrix components. Plays a role in the regulation of skeletogenesis, through a mechanism that involves integrin-mediated signaling and PTK2B/PYK2 (PubMed:33242826)"
O15232,Matrilin-3,MATN3,Homo sapiens,"B2CPU0, Q4ZG02",UP000005640,Major component of the extracellular matrix of cartilage and may play a role in the formation of extracellular filamentous networks
O15245,Solute carrier family 22 member 1,SLC22A1,Homo sapiens,"A6NFF3, A8K1H2, C9JSU6, O15395, Q9NQD4",UP000005640,"Electrogenic voltage-dependent transporter that mediates the transport of a variety of organic cations such as endogenous bioactive amines, cationic drugs and xenobiotics (PubMed:11388889, PubMed:11408531, PubMed:12439218, PubMed:12719534, PubMed:15389554, PubMed:16263091, PubMed:16272756, PubMed:16581093, PubMed:19536068, PubMed:21128598, PubMed:23680637, PubMed:24961373, PubMed:34040533, PubMed:9187257, PubMed:9260930, PubMed:9655880). Functions as a pH- and Na(+)-independent, bidirectional transporter (By similarity). Cation cellular uptake or release is driven by the electrochemical potential (i.e. membrane potential and concentration gradient) and substrate selectivity (By similarity). Hydrophobicity is a major requirement for recognition in polyvalent substrates and inhibitors (By similarity). Primarily expressed at the basolateral membrane of hepatocytes and proximal tubules and involved in the uptake and disposition of cationic compounds by hepatic and renal clearance from the blood flow (By similarity). Most likely functions as an uptake carrier in enterocytes contributing to the intestinal elimination of organic cations from the systemic circulation (PubMed:16263091). Transports endogenous monoamines such as N-1-methylnicotinamide (NMN), guanidine, histamine, neurotransmitters dopamine, serotonin and adrenaline (PubMed:12439218, PubMed:24961373, PubMed:35469921, PubMed:9260930). Also transports natural polyamines such as spermidine, agmatine and putrescine at low affinity, but relatively high turnover (PubMed:21128598). Involved in the hepatic uptake of vitamin B1/thiamine, hence regulating hepatic lipid and energy metabolism (PubMed:24961373). Mediates the bidirectional transport of acetylcholine (ACh) at the apical membrane of ciliated cell in airway epithelium, thereby playing a role in luminal release of ACh from bronchial epithelium (PubMed:15817714). Transports dopaminergic neuromodulators cyclo(his-pro) and salsolinol with lower efficency (PubMed:17460754). Also capable of transporting non-amine endogenous compounds such as prostaglandin E2 (PGE2) and prostaglandin F2-alpha (PGF2-alpha) (PubMed:11907186). May contribute to the transport of cationic compounds in testes across the blood-testis-barrier (Probable). Also involved in the uptake of xenobiotics tributylmethylammonium (TBuMA), quinidine, N-methyl-quinine (NMQ), N-methyl-quinidine (NMQD) N-(4,4-azo-n-pentyl)-quinuclidine (APQ), azidoprocainamide methoiodide (AMP), N-(4,4-azo-n-pentyl)-21-deoxyajmalinium (APDA) and 4-(4-(dimethylamino)styryl)-N-methylpyridinium (ASP) (PubMed:11408531, PubMed:15389554, PubMed:35469921, PubMed:9260930)"
O15247,Chloride intracellular channel protein 2,CLIC2,Homo sapiens,"A8K9S0, O15174, Q5JT80, Q8TCE3",UP000005640,"In the soluble state, catalyzes glutaredoxin-like thiol disulfide exchange reactions with reduced glutathione as electron donor. Displays weak glutathione peroxidase activity (Probable) (PubMed:25581026). Can insert into membranes and form chloride ion channels. Membrane insertion seems to be redox-regulated and may occur only under oxidizing conditions. Modulates the activity of RYR2 and inhibits calcium influx"
O15259,Nephrocystin-1,NPHP1,Homo sapiens,O14837,UP000005640,"Together with BCAR1 it may play a role in the control of epithelial cell polarity (By similarity). Involved in the organization of apical junctions in kidney cells together with NPHP4 and RPGRIP1L/NPHP8 (By similarity). Does not seem to be strictly required for ciliogenesis (By similarity). Seems to help to recruit PTK2B/PYK2 to cell matrix adhesions, thereby initiating phosphorylation of PTK2B/PYK2 and PTK2B/PYK2-dependent signaling (By similarity). May play a role in the regulation of intraflagellar transport (IFT) during cilia assembly. Required for normal retina development (By similarity). In connecting photoreceptor cilia influences the movement of some IFT proteins such as IFT88 and WDR19. Involved in spermatogenesis (By similarity)"
O15260,Surfeit locus protein 4,SURF4,Homo sapiens,"B7Z6A4, O60923, Q5T8U6, Q9UNZ0, Q9UNZ1",UP000005640,"Endoplasmic reticulum cargo receptor that mediates the export of lipoproteins by recruiting cargos into COPII vesicles to facilitate their secretion (PubMed:29643117, PubMed:30251625, PubMed:33186557). Acts as a cargo receptor for lipoproteins bearing both APOB and APOA1, thereby regulating lipoprotein delivery and the maintenance of lipid homeostasis (PubMed:29643117, PubMed:33186557). Synergizes with the GTPase SAR1B to mediate transport of circulating lipoproteins (PubMed:33186557). Promotes the secretion of PCSK9 (PubMed:30251625). Also mediates the efficient secretion of erythropoietin (EPO) (PubMed:32989016). May also play a role in the maintenance of the architecture of the endoplasmic reticulum-Golgi intermediate compartment and of the Golgi (PubMed:18287528)"
O15263,Defensin beta 4A,"DEFB4A, DEFB4B",Homo sapiens,Q52LC0,UP000005640,"Exhibits antimicrobial activity against Gram-negative bacteria and Gram-positive bacteria, with highest activity against Gram-negative bacteria (PubMed:10837369, PubMed:9202117). Antimicrobial activity against P.aruginosa seems to be salt-sensitive and is reduced with high salt concentrations greater than 25 mM (PubMed:10837369). Also exhibits antimicrobial activity against the yeast C.albicans (PubMed:10837369, PubMed:30050988, PubMed:9202117). Permeabilizes C.albicans cell membranes via targeting plasma membrane lipid phosphatidylinositol 4,5-bisphosphate (PIP2), thereby leading to cell fragmentation and cell death (PubMed:30050988). Acts as a ligand for C-C chemokine receptor CCR6 (PubMed:10521347, PubMed:20068036). Binds to CCR6 and induces chemotactic activity of CCR6-expressing cells, such as immature dendritic cells and memory T cells (PubMed:10521347, PubMed:20068036)"
O15265,Ataxin-7,ATXN7,Homo sapiens,"B4E207, E9PHP9, O75328, O75329, Q9Y6P8",UP000005640,"Acts as a component of the STAGA transcription coactivator-HAT complex (PubMed:15932940, PubMed:18206972). Mediates the interaction of STAGA complex with the CRX and is involved in CRX-dependent gene activation (PubMed:15932940, PubMed:18206972). Necessary for microtubule cytoskeleton stabilization (PubMed:22100762)"
O15266,Short stature homeobox protein,SHOX,Homo sapiens,"O00412, O00413, O15267","UP000005640, UP000005640",Controls fundamental aspects of growth and development
O15269,Serine palmitoyltransferase 1,SPTLC1,Homo sapiens,"A8K681, Q5VWB4, Q96IX6",UP000005640,"Component of the serine palmitoyltransferase multisubunit enzyme (SPT) that catalyzes the initial and rate-limiting step in sphingolipid biosynthesis by condensing L-serine and activated acyl-CoA (most commonly palmitoyl-CoA) to form long-chain bases. The SPT complex is also composed of SPTLC2 or SPTLC3 and SPTSSA or SPTSSB. Within this complex, the heterodimer with SPTLC2 or SPTLC3 forms the catalytic core (PubMed:19416851, PubMed:36170811, PubMed:33558762). The composition of the serine palmitoyltransferase (SPT) complex determines the substrate preference (PubMed:19416851, PubMed:33558762). The SPTLC1-SPTLC2-SPTSSA complex shows a strong preference for C16-CoA substrate, while the SPTLC1-SPTLC3-SPTSSA isozyme uses both C14-CoA and C16-CoA as substrates, with a slight preference for C14-CoA (PubMed:19648650, PubMed:19416851). The SPTLC1-SPTLC2-SPTSSB complex shows a strong preference for C18-CoA substrate, while the SPTLC1-SPTLC3-SPTSSB isozyme displays an ability to use a broader range of acyl-CoAs, without apparent preference (PubMed:19648650, PubMed:19416851, PubMed:33558761, PubMed:33558762). Required for adipocyte cell viability and metabolic homeostasis (By similarity)"
O15297,Protein phosphatase 1D,PPM1D,Homo sapiens,"Q53XP4, Q6P991, Q8IVR6",UP000005640,"Involved in the negative regulation of p53 expression (PubMed:23242139). Required for the relief of p53-dependent checkpoint mediated cell cycle arrest. Binds to and dephosphorylates 'Ser-15' of TP53 and 'Ser-345' of CHEK1 which contributes to the functional inactivation of these proteins (PubMed:15870257, PubMed:16311512). Mediates MAPK14 dephosphorylation and inactivation (PubMed:21283629). Is also an important regulator of global heterochromatin silencing and critical in maintaining genome integrity (By similarity)"
O15318,DNA-directed RNA polymerase III subunit RPC7,POLR3G,Homo sapiens,A8MTH0,UP000005640,"DNA-dependent RNA polymerase catalyzes the transcription of DNA into RNA using the four ribonucleoside triphosphates as substrates (PubMed:20413673, PubMed:33558764, PubMed:34675218, PubMed:35637192). Specific peripheric component of RNA polymerase III (Pol III) which synthesizes small non-coding RNAs including 5S rRNA, snRNAs, tRNAs and miRNAs from at least 500 distinct genomic loci (PubMed:20154270, PubMed:20413673, PubMed:35637192). Acts as a long tether that bridges POLR3C/RPC3-POLR3F/RPC6-POLR3G/RPC7 heterotrimer and the mobile stalk of Pol III, coordinating the dynamics of Pol III stalk and clamp modules during the transition from apo to elongation state. Pol III exists as two alternative complexes defined by the mutually exclusive incorporation of subunit POLR3G/RPC7alpha or POLR3GL/RPC7beta. POLR3G/RPC7alpha modulates Pol III transcriptome by specifically enhancing the transcription of snaR-A non-coding RNAs. At resting state, occupies the active site of apo Pol III and keeps Pol III in an autoinhibitory mode, preventing non-specific transcription (PubMed:33558764, PubMed:33558766, PubMed:35637192). Pol III plays a key role in sensing and limiting infection by intracellular bacteria and DNA viruses. Acts as a nuclear and cytosolic DNA sensor involved in innate immune response. Can sense non-self dsDNA that serves as template for transcription into dsRNA. The non-self RNA polymerase III transcripts, such as Epstein-Barr virus-encoded RNAs (EBERs), induce type I interferon and NF-kappa-B through the RIG-I pathway (PubMed:19609254, PubMed:19631370)"
O15389,Sialic acid-binding Ig-like lectin 5,SIGLEC5,Homo sapiens,,UP000005640,"Putative adhesion molecule that mediates sialic-acid dependent binding to cells. Binds equally to alpha-2,3-linked and alpha-2,6-linked sialic acid. The sialic acid recognition site may be masked by cis interactions with sialic acids on the same cell surface"
O15399,"Glutamate receptor ionotropic, NMDA 2D",GRIN2D,Homo sapiens,,UP000005640,"Component of NMDA receptor complexes that function as heterotetrameric, ligand-gated ion channels with high calcium permeability and voltage-dependent sensitivity to magnesium. Channel activation requires binding of the neurotransmitter glutamate to the epsilon subunit, glycine binding to the zeta subunit, plus membrane depolarization to eliminate channel inhibition by Mg(2+) (PubMed:26875626, PubMed:27616483, PubMed:28126851, PubMed:9489750). Sensitivity to glutamate and channel kinetics depend on the subunit composition (PubMed:9489750)"
O15400,Syntaxin-7,STX7,Homo sapiens,"E1P579, Q5SZW2, Q96ES9",UP000005640,May be involved in protein trafficking from the plasma membrane to the early endosome (EE) as well as in homotypic fusion of endocytic organelles. Mediates the endocytic trafficking from early endosomes to late endosomes and lysosomes
O15446,DNA-directed RNA polymerase I subunit RPA34,POLR1G,Homo sapiens,"Q32N11, Q7Z5U2, Q9UPF6",UP000005640,"Component of RNA polymerase I (Pol I), a DNA-dependent RNA polymerase which synthesizes ribosomal RNA precursors using the four ribonucleoside triphosphates as substrates. Involved in UBTF-activated transcription, presumably at a step following PIC formation"
O15484,Calpain-5,CAPN5,Homo sapiens,O00263,UP000005640,Calcium-regulated non-lysosomal thiol-protease
O15488,Glycogenin-2,GYG2,Homo sapiens,"B7WNN6, O15485, O15486, O15487, O15489, O15490",UP000005640,"Glycogenin participates in the glycogen biosynthetic process along with glycogen synthase and glycogen branching enzyme. It self-glucosylates, via an inter-subunit mechanism, to form an oligosaccharide primer that serves as substrate for glycogen synthase"
O15511,Actin-related protein 2/3 complex subunit 5,ARPC5,Homo sapiens,"A6NEC4, Q6PG42",UP000005640,"Component of the Arp2/3 complex, a multiprotein complex that mediates actin polymerization upon stimulation by nucleation-promoting factor (NPF) (PubMed:9230079). The Arp2/3 complex mediates the formation of branched actin networks in the cytoplasm, providing the force for cell motility (PubMed:9230079). In addition to its role in the cytoplasmic cytoskeleton, the Arp2/3 complex also promotes actin polymerization in the nucleus, thereby regulating gene transcription and repair of damaged DNA (PubMed:29925947). The Arp2/3 complex promotes homologous recombination (HR) repair in response to DNA damage by promoting nuclear actin polymerization, leading to drive motility of double-strand breaks (DSBs) (PubMed:29925947)"
O15520,Fibroblast growth factor 10,FGF10,Homo sapiens,"C7FDY0, Q6FHR3, Q6FHT6, Q96P59",UP000005640,"Plays an important role in the regulation of embryonic development, cell proliferation and cell differentiation. Required for normal branching morphogenesis. May play a role in wound healing"
